Question,Answer
Not all attacks,"Not all attacks are financially motivated, however: security firm HBGary Federal had a serious series of attacks in 2011 from hacktivist group Anonymous in retaliation for the firm's CEO claiming to have infiltrated their group, and Sony Pictures was hacked in 2014 with the apparent dual motive of embarrassing the company through data leaks and crippling the company by wiping workstations and servers."
Vehicles are increasingly,"Vehicles are increasingly computerized, with engine timing, cruise control, anti-lock brakes, seat belt tensioners, door locks, airbags and advanced driver-assistance systems on many models"
"Additionally, connected cars","Additionally, connected cars may use WiFi and Bluetooth to communicate with onboard consumer devices and the cell phone network"
Self-driving cars are,Self-driving cars are expected to be even more complex
All of these,"All of these systems carry some security risks, and such issues have gained wide attention."
Simple examples of,"Simple examples of risk include a malicious compact disc being used as an attack vector, and the car's onboard microphones being used for eavesdropping"
"However, if access","However, if access is gained to a car's internal controller area network, the danger is much greater – and in a widely publicized 2015 test, hackers remotely carjacked a vehicle from 10 miles away and drove it into a ditch."
Manufacturers are reacting,"Manufacturers are reacting in numerous ways, with Tesla in 2016 pushing out some security fixes over the air into its cars' computer systems"
In the area,"In the area of autonomous vehicles, in September 2016 the United States Department of Transportation announced some initial safety standards, and called for states to come up with uniform policies."
"Additionally, e-Drivers' licenses","Additionally, e-Drivers' licenses are being developed using the same technology"
"For example, Mexico's","For example, Mexico's licensing authority (ICV) has used a smart card platform to issue the first e-Drivers' licenses to the city of Monterrey, in the state of Nuevo León."
Shipping companies have,"Shipping companies have adopted RFID (Radio Frequency Identification) technology as an efficient, digitally secure, tracking device"
"Unlike a barcode,","Unlike a barcode, RFID can be read up to 20 feet away"
Government and military,Government and military computer systems are commonly attacked by activists and foreign powers
Local and regional,"Local and regional government infrastructure such as traffic light controls, police and intelligence agency communications, personnel records, as well as student records."
"The FBI, CIA,","The FBI, CIA, and Pentagon, all utilize secure controlled access technology for any of their buildings"
"However, the use","However, the use of this form of technology is spreading into the entrepreneurial world"
More and more,More and more companies are taking advantage of the development of digitally secure controlled access technology
"GE's ACUVision, for","GE's ACUVision, for example, offers a single panel platform for access control, alarm monitoring and digital recording."
=== Internet of,=== Internet of things and physical vulnerabilities ===
The Internet of,"The Internet of things (IoT) is the network of physical objects such as devices, vehicles, and buildings that are embedded with electronics, software, sensors, and network connectivity that enables them to collect and exchange data"
Concerns have been,Concerns have been raised that this is being developed without appropriate consideration of the security challenges involved.
While the IoT,"While the IoT creates opportunities for more direct integration of the physical world into computer-based systems,"
it also provides,it also provides opportunities for misuse
"In particular, as","In particular, as the Internet of Things spreads widely, cyberattacks are likely to become an increasingly physical (rather than simply virtual) threat"
If a front,"If a front door's lock is connected to the Internet, and can be locked/unlocked from a phone, then a criminal could enter the home at the press of a button from a stolen or hacked phone"
People could stand,People could stand to lose much more than their credit card numbers in a world controlled by IoT-enabled devices
Thieves have also,Thieves have also used electronic means to circumvent non-Internet-connected hotel door locks.
An attack aimed,An attack aimed at physical infrastructure or human lives is often called a cyber-kinetic attack
As IoT devices,"As IoT devices and appliances become more widespread, the prevalence and potential damage of cyber-kinetic attacks can increase substantially."
Medical devices have,"Medical devices have either been successfully attacked or had potentially deadly vulnerabilities demonstrated, including both in-hospital diagnostic equipment and implanted devices including pacemakers and insulin pumps"
There are many,"There are many reports of hospitals and hospital organizations getting hacked, including ransomware attacks, Windows XP exploits, viruses, and data breaches of sensitive data stored on hospital servers"
On 28 December,On 28 December 2016 the US Food and Drug Administration released its recommendations for how medical device manufacturers should maintain the security of Internet-connected devices – but no structure for enforcement.
In distributed generation,"In distributed generation systems, the risk of a cyber attack is real, according to Daily Energy Insider"
An attack could,"An attack could cause a loss of power in a large area for a long period of time, and such an attack could have just as severe consequences as a natural disaster"
The District of,"The District of Columbia is considering creating a Distributed Energy Resources (DER) Authority within the city, with the goal being for customers to have more insight into their own energy use and giving the local electric utility, Pepco, the chance to better estimate energy demand"
"proposal, however, would","proposal, however, would ""allow third-party vendors to create numerous points of energy distribution, which could potentially create more opportunities for cyber attackers to threaten the electric grid."""
Perhaps the most,"Perhaps the most widely known digitally secure telecommunication device is the SIM (Subscriber Identity Module) card, a device that is embedded in most of the world's cellular devices before any service can be obtained"
The SIM card,The SIM card is just the beginning of this digitally secure environment.
The Smart Card,The Smart Card Web Servers draft standard (SCWS) defines the interfaces to an HTTP server in a smart card
Tests are being,"Tests are being conducted to secure OTA (""over-the-air"") payment and credit card information from and to a mobile phone"
Combination SIM/DVD devices,Combination SIM/DVD devices are being developed through Smart Video Card technology which embeds a DVD-compliant optical disc into the card body of a regular SIM card.
Other telecommunication developments,"Other telecommunication developments involving digital security include mobile signatures, which use the embedded SIM card to generate a legally binding electronic signature."
== Cost and,== Cost and impact of security breaches ==
Serious financial damage,"Serious financial damage has been caused by security breaches, but because there is no standard model for estimating the cost of an incident, the only data available is that which is made public by the organizations involved"
"""Several computer security","""Several computer security consulting firms produce estimates of total worldwide losses attributable to virus and worm attacks and to hostile digital acts in general"
The 2003 loss,The 2003 loss estimates by these firms range from $13 billion (worms and viruses only) to $226 billion (for all forms of covert attacks)
The reliability of,"The reliability of these estimates is often challenged; the underlying methodology is basically anecdotal."""
"However, reasonable estimates","However, reasonable estimates of the financial cost of security breaches can actually help organizations make rational investment decisions"
According to the,"According to the classic Gordon-Loeb Model analyzing the optimal investment level in information security, one can conclude that the amount a firm spends to protect information should generally be only a small fraction of the expected loss (i.e., the expected value of the loss resulting from a cyber/information security breach)."
As with physical,"As with physical security, the motivations for breaches of computer security vary between attackers"
Some are thrill-seekers,"Some are thrill-seekers or vandals, some are activists, others are criminals looking for financial gain"
State-sponsored attackers are,"State-sponsored attackers are now common and well resourced but started with amateurs such as Markus Hess who hacked for the KGB, as recounted by Clifford Stoll in The Cuckoo's Egg."
Attackers motivations can,Attackers motivations can vary for all types of attacks from pleasure to political goals
"For example, hacktivists","For example, hacktivists may target a company or organization that carries out activities they do not agree with"
This would be,This would be to create bad publicity for the company by having its website crash.
"High capability hackers,","High capability hackers, often with larger backing or state sponsorship, may attack based on the demands of their financial backers"
These attacks are,These attacks are more likely to attempt more serious attack
An example of,"An example of a more serious attack was the 2015 Ukraine power grid hack, which reportedly utilised the spear-phising, destruction of files, and denial-of-service attacks to carry out the full attack."
"Additionally, recent attacker","Additionally, recent attacker motivations can be traced back to extremist organizations seeking to gain political advantage or disrupt social agendas"
The growth of,"The growth of the internet, mobile technologies, and inexpensive computing devices have led to a rise in capabilities but also to the risk to environments that are deemed as vital to operations"
All critical targeted,All critical targeted environments are susceptible to compromise and this has led to a series of proactive studies on how to migrate the risk by taking into consideration motivations by these types of actors
Several stark differences,Several stark differences exist between the hacker motivation and that of nation state actors seeking to attack based on an ideological preference.
A key aspect,A key aspect of threat modeling for any system is identifying the motivations behind potential attacks and the individuals or groups likely to carry them out
The level and,The level and detail of security measures will differ based on the specific system being protected
"For instance, a","For instance, a home personal computer, a bank, and a classified military network each face distinct threats, despite using similar underlying technologies."
== Computer security,== Computer security incident management ==
Computer security incident,Computer security incident management is an organized approach to addressing and managing the aftermath of a computer security incident or compromise with the goal of preventing a breach or thwarting a cyberattack
An incident that,An incident that is not identified and managed at the time of intrusion typically escalates to a more damaging event such as a data breach or system failure
The intended outcome,"The intended outcome of a computer security incident response plan is to contain the incident, limit damage and assist recovery to business as usual"
Responding to compromises,"Responding to compromises quickly can mitigate exploited vulnerabilities, restore services and processes and minimize losses."
Incident response planning,Incident response planning allows an organization to establish a series of best practices to stop an intrusion before it causes damage
Typical incident response,Typical incident response plans contain a set of written instructions that outline the organization's response to a cyberattack
Without a documented,"Without a documented plan in place, an organization may not successfully detect an intrusion or compromise and stakeholders may not understand their roles, processes and procedures during an escalation, slowing the organization's response and resolution."
There are four,There are four key components of a computer security incident response plan:
Preparation: Preparing stakeholders,Preparation: Preparing stakeholders on the procedures for handling computer security incidents or compromises
Detection and analysis:,"Detection and analysis: Identifying and investigating suspicious activity to confirm a security incident, prioritizing the response based on impact and coordinating notification of the incident"
"Containment, eradication and","Containment, eradication and recovery: Isolating affected systems to prevent escalation and limit impact, pinpointing the genesis of the incident, removing malware, affected systems and bad actors from the environment and restoring systems and data when a threat no longer remains"
Post incident activity:,"Post incident activity: Post mortem analysis of the incident, its root cause and the organization's response with the intent of improving the incident response plan and future response efforts."
Some illustrative examples,Some illustrative examples of different types of computer security breaches are given below.
=== Robert Morris,=== Robert Morris and the first computer worm ===
"In 1988, 60,000","In 1988, 60,000 computers were connected to the Internet, and most were mainframes, minicomputers and professional workstations"
On 2 November,"On 2 November 1988, many started to slow down, because they were running a malicious code that demanded processor time and that spread itself to other computers – the first internet computer worm"
The software was,"The software was traced back to 23-year-old Cornell University graduate student Robert Tappan Morris who said ""he wanted to count how many machines were connected to the Internet""."
"In 1994, over","In 1994, over a hundred intrusions were made by unidentified crackers into the Rome Laboratory, the US Air Force's main command and research facility"
"Using trojan horses,","Using trojan horses, hackers were able to obtain unrestricted access to Rome's networking systems and remove traces of their activities"
The intruders were,"The intruders were able to obtain classified files, such as air tasking order systems data and furthermore able to penetrate connected networks of National Aeronautics and Space Administration's Goddard Space Flight Center, Wright-Patterson Air Force Base, some Defense contractors, and other private sector organizations, by posing as a trusted Rome center user."
"In early 2007,","In early 2007, American apparel and home goods company TJX announced that it was the victim of an unauthorized computer systems intrusion and that the hackers had accessed a system that stored data on credit card, debit card, check, and merchandise return transactions."
"In 2010, the","In 2010, the computer worm known as Stuxnet reportedly ruined almost one-fifth of Iran's nuclear centrifuges"
It did so,It did so by disrupting industrial programmable logic controllers (PLCs) in a targeted attack
This is generally,This is generally believed to have been launched by Israel and the United States to disrupt Iran's nuclear program – although neither has publicly admitted this.
"In early 2013,","In early 2013, documents provided by Edward Snowden were published by The Washington Post and The Guardian exposing the massive scale of NSA global surveillance"
There were also,There were also indications that the NSA may have inserted a backdoor in a NIST standard for encryption
This standard was,This standard was later withdrawn due to widespread criticism
The NSA additionally,The NSA additionally were revealed to have tapped the links between Google's data centers.
A Ukrainian hacker,"A Ukrainian hacker known as Rescator broke into Target Corporation computers in 2013, stealing roughly 40 million credit cards, and then Home Depot computers in 2014, stealing between 53 and 56 million credit card numbers"
Warnings were delivered,"Warnings were delivered at both corporations, but ignored; physical security breaches using self checkout machines are believed to have played a large role"
"""The malware utilized","""The malware utilized is absolutely unsophisticated and uninteresting,"" says Jim Walter, director of threat intelligence operations at security technology company McAfee – meaning that the heists could have easily been stopped by existing antivirus software had administrators responded to the warnings"
The size of,The size of the thefts has resulted in major attention from state and Federal United States authorities and the investigation is ongoing.
=== Office of,=== Office of Personnel Management data breach ===
"In April 2015,","In April 2015, the Office of Personnel Management discovered it had been hacked more than a year earlier in a data breach, resulting in the theft of approximately 21.5 million personnel records handled by the office"
The Office of,The Office of Personnel Management hack has been described by federal officials as among the largest breaches of government data in the history of the United States
Data targeted in,"Data targeted in the breach included personally identifiable information such as Social Security numbers, names, dates and places of birth, addresses, and fingerprints of current and former government employees as well as anyone who had undergone a government background check"
It is believed,It is believed the hack was perpetrated by Chinese hackers.
"In July 2015,","In July 2015, a hacker group known as The Impact Team successfully breached the extramarital relationship website Ashley Madison, created by Avid Life Media"
The group claimed,The group claimed that they had taken not only company data but user data as well
"After the breach,","After the breach, The Impact Team dumped emails from the company's CEO, to prove their point, and threatened to dump customer data unless the website was taken down permanently"
When Avid Life,"When Avid Life Media did not take the site offline the group released two more compressed files, one 9.7GB and the second 20GB"
After the second,"After the second data dump, Avid Life Media CEO Noel Biderman resigned; but the website remained to function."
=== Colonial Pipeline,=== Colonial Pipeline ransomware attack ===
"In June 2021,","In June 2021, the cyber attack took down the largest fuel pipeline in the U.S"
and led to,and led to shortages across the East Coast.
International legal issues,International legal issues of cyber attacks are complicated in nature
There is no,"There is no global base of common rules to judge, and eventually punish, cybercrimes and cybercriminals - and where security firms or agencies do locate the cybercriminal behind the creation of a particular piece of malware or form of cyber attack, often the local authorities cannot take action due to lack of laws under which to prosecute"
Proving attribution for,Proving attribution for cybercrimes and cyberattacks is also a major problem for all law enforcement agencies
"""Computer viruses switch","""Computer viruses switch from one country to another, from one jurisdiction to another – moving around the world, using the fact that we don't have the capability to globally police operations like this"
So the Internet,"So the Internet is as if someone [had] given free plane tickets to all the online criminals of the world."" The use of techniques such as dynamic DNS, fast flux and bullet proof servers add to the difficulty of investigation and enforcement."
The role of,"The role of the government is to make regulations to force companies and organizations to protect their systems, infrastructure and information from any cyberattacks, but also to protect its own national infrastructure such as the national power-grid."
The government's regulatory,The government's regulatory role in cyberspace is complicated
"For some, cyberspace","For some, cyberspace was seen as a virtual space that was to remain free of government intervention, as can be seen in many of today's libertarian blockchain and bitcoin discussions."
Many government officials,"Many government officials and experts think that the government should do more and that there is a crucial need for improved regulation, mainly due to the failure of the private sector to solve efficiently the cyber security problem"
Clarke said during,"Clarke said during a panel discussion at the RSA Security Conference in San Francisco, he believes that the ""industry only responds when you threaten regulation"
If the industry,"If the industry doesn't respond (to the threat), you have to follow through."" On the other hand, executives from the private sector agree that improvements are necessary, but think that government intervention would affect their ability to innovate efficiently"
McCarthy analyzed this,McCarthy analyzed this public-private partnership in cyber security and reflected on the role of cyber security in the broader constitution of political order.
On 22 May,"On 22 May 2020, the UN Security Council held its second ever informal meeting on cyber security to focus on cyber challenges to international peace"
According to UN,"According to UN Secretary-General António Guterres, new technologies are too often used to violate rights."
Many different teams,"Many different teams and organizations exist, including:"
The Forum of,The Forum of Incident Response and Security Teams (FIRST) is the global association of CSIRTs
"The US-CERT, AT&T,","The US-CERT, AT&T, Apple, Cisco, McAfee, Microsoft are all members of this international team."
The Council of,The Council of Europe helps protect societies worldwide from the threat of cybercrime through the Convention on Cybercrime.
The purpose of,"The purpose of the Messaging Anti-Abuse Working Group (MAAWG) is to bring the messaging industry together to work collaboratively and to successfully address the various forms of messaging abuse, such as spam, viruses, denial-of-service attacks and other messaging exploitations"
"France Telecom, Facebook,","France Telecom, Facebook, AT&T, Apple, Cisco, Sprint are some of the members of the MAAWG."
ENISA : The,ENISA : The European Network and Information Security Agency (ENISA) is an agency of the European Union with the objective to improve network and information security in the European Union.
On 14 April,"On 14 April 2016, the European Parliament and the Council of the European Union adopted the General Data Protection Regulation (GDPR)"
"The GDPR, which","The GDPR, which came into force on 25 May 2018, grants individuals within the European Union (EU) and the European Economic Area (EEA) the right to the protection of personal data"
The regulation requires,The regulation requires that any entity that processes personal data incorporate data protection by design and by default
It also requires,It also requires that certain organizations appoint a Data Protection Officer (DPO).
The IT Security,"The IT Security Association TeleTrusT exist in Germany since June 1986, which is an international competence network for IT security."
=== Computer emergency,=== Computer emergency response teams ===
Most countries have,Most countries have their own computer emergency response team to protect network security.
"Since 2010, Canada","Since 2010, Canada has had a cyber security strategy"
This functions as,This functions as a counterpart document to the National Strategy and Action Plan for Critical Infrastructure
The strategy has,"The strategy has three main pillars: securing government systems, securing vital private cyber systems, and helping Canadians to be secure online"
There is also,There is also a Cyber Incident Management Framework to provide a coordinated response in the event of a cyber incident.
The Canadian Cyber,The Canadian Cyber Incident Response Centre (CCIRC) is responsible for mitigating and responding to threats to Canada's critical infrastructure and cyber systems
It provides support,"It provides support to mitigate cyber threats, technical support to respond & recover from targeted cyber attacks, and provides online tools for members of Canada's critical infrastructure sectors"
It posts regular,It posts regular cyber security bulletins & operates an online reporting tool where individuals and organizations can report a cyber incident.
To inform the,"To inform the general public on how to protect themselves online, Public Safety Canada has partnered with STOP.THINK.CONNECT, a coalition of non-profit, private sector, and government organizations, and launched the Cyber Security Cooperation Program"
They also run,"They also run the GetCyberSafe portal for Canadian citizens, and Cyber Security Awareness Month during October."
Public Safety Canada,Public Safety Canada aims to begin an evaluation of Canada's cyber security strategy in early 2015.
Australian federal government,Australian federal government announced an $18.2 million investment to fortify the cyber security resilience of small and medium enterprises (SMEs) and enhance their capabilities in responding to cyber threats
This financial backing,This financial backing is an integral component of the 2023-2030 Australian Cyber Security Strategy
