Question,Answer
"In April 2023,","In April 2023, the United Kingdom Department for Science, Innovation & Technology released a report on cyber attacks over the previous 12 months"
"They surveyed 2,263","They surveyed 2,263 UK businesses, 1,174 UK registered charities, and 554 education institutions"
The research found,"The research found that ""32% of businesses and 24% of charities overall recall any breaches or attacks from the last 12 months."" These figures were much higher for ""medium businesses (59%), large businesses (69%), and high-income charities with £500,000 or more in annual income (56%)."" Yet, although medium or large businesses are more often the victims, since larger companies have generally improved their security over the last decade, small and midsize businesses (SMBs) have also become increasingly vulnerable as they often ""do not have advanced tools to defend the business."" SMBs are most likely to be affected by malware, ransomware, phishing, man-in-the-middle attacks, and Denial-of Service (DoS) Attacks."
Normal internet users,Normal internet users are most likely to be affected by untargeted cyberattacks
These are where,"These are where attackers indiscriminately target as many devices, services, or users as possible"
They do this,They do this using techniques that take advantage of the openness of the Internet
These strategies mostly,"These strategies mostly include phishing, ransomware, water holing and scanning."
To secure a,"To secure a computer system, it is important to understand the attacks that can be made against it, and these threats can typically be classified into one of the following categories:"
A backdoor in,"A backdoor in a computer system, a cryptosystem, or an algorithm is any secret method of bypassing normal authentication or security controls"
These weaknesses may,"These weaknesses may exist for many reasons, including original design or poor configuration"
Due to the,"Due to the nature of backdoors, they are of greater concern to companies and databases as opposed to individuals."
Backdoors may be,Backdoors may be added by an authorized party to allow some legitimate access or by an attacker for malicious reasons
Criminals often use,"Criminals often use malware to install backdoors, giving them remote administrative access to a system"
Once they have,"Once they have access, cybercriminals can ""modify files, steal personal information, install unwanted software, and even take control of the entire computer."""
Backdoors can be,"Backdoors can be difficult to detect, as they often remain hidden within the source code or system firmware intimate knowledge of the operating system of the computer."
Denial-of-service attacks (DoS),Denial-of-service attacks (DoS) are designed to make a machine or network resource unavailable to its intended users
Attackers can deny,"Attackers can deny service to individual victims, such as by deliberately entering a wrong password enough consecutive times to cause the victim's account to be locked, or they may overload the capabilities of a machine or network and block all users at once"
While a network,"While a network attack from a single IP address can be blocked by adding a new firewall rule, many forms of distributed denial-of-service (DDoS) attacks are possible, where the attack comes from a large number of points"
"In this case,","In this case, defending against these attacks is much more difficult"
Such attacks can,"Such attacks can originate from the zombie computers of a botnet or from a range of other possible techniques, including distributed reflective denial-of-service (DRDoS), where innocent systems are fooled into sending traffic to the victim"
"With such attacks,","With such attacks, the amplification factor makes the attack easier for the attacker because they have to use little bandwidth themselves"
To understand why,"To understand why attackers may carry out these attacks, see the 'attacker motivation' section."
A direct-access attack,"A direct-access attack is when an unauthorized user (an attacker) gains physical access to a computer, most likely to directly copy data from it or steal information"
Attackers may also,"Attackers may also compromise security by making operating system modifications, installing software worms, keyloggers, covert listening devices or using wireless microphones"
Even when the,"Even when the system is protected by standard security measures, these may be bypassed by booting another operating system or tool from a CD-ROM or other bootable media"
Disk encryption and,Disk encryption and the Trusted Platform Module standard are designed to prevent these attacks.
Direct service attackers,Direct service attackers are related in concept to direct memory attacks which allow an attacker to gain direct access to a computer's memory
"The attacks ""take","The attacks ""take advantage of a feature of modern computers that allows certain devices, such as external hard drives, graphics cards, or network cards, to access the computer's memory directly."""
Eavesdropping is the,"Eavesdropping is the act of surreptitiously listening to a private computer conversation (communication), usually between hosts on a network"
It typically occurs,"It typically occurs when a user connects to a network where traffic is not secured or encrypted and sends sensitive business data to a colleague, which, when listened to by an attacker, could be exploited"
Data transmitted across,Data transmitted across an open network allows an attacker to exploit a vulnerability and intercept it via various methods.
"Unlike malware, direct-access","Unlike malware, direct-access attacks, or other forms of cyber attacks, eavesdropping attacks are unlikely to negatively affect the performance of networks or devices, making them difficult to notice"
"In fact, ""the","In fact, ""the attacker does not need to have any ongoing connection to the software at all"
The attacker can,"The attacker can insert the software onto a compromised device, perhaps by direct insertion or perhaps by a virus or other malware, and then come back some time later to retrieve any data that is found or trigger the software to send the data at some determined time."""
Using a virtual,"Using a virtual private network (VPN), which encrypts data between two points, is one of the most common forms of protection against eavesdropping"
Using the best,"Using the best form of encryption possible for wireless networks is best practice, as well as using HTTPS instead of an unencrypted HTTP."
Programs such as,Programs such as Carnivore and NarusInSight have been used by the Federal Bureau of Investigation (FBI) and the NSA to eavesdrop on the systems of internet service providers
Even machines that,"Even machines that operate as a closed system (i.e., with no contact with the outside world) can be eavesdropped upon by monitoring the faint electromagnetic transmissions generated by the hardware"
TEMPEST is a,TEMPEST is a specification by the NSA referring to these attacks.
Malicious software (malware),"Malicious software (malware) is any software code or computer program ""intentionally written to harm a computer system or its users."" Once present on a computer, it can leak sensitive details such as personal information, business information and passwords, can give control of the system to the attacker, and can corrupt or delete data permanently."
Viruses are a,"Viruses are a specific type of malware, and are normally a malicious code that hijacks software with the intention to ""do damage and spread copies of itself."" Copies are made with the aim of spreading to other programs on a computer."
Worms are similar,"Worms are similar to viruses, however viruses can only function when a user runs (opens) a compromised program"
Worms are self-replicating,"Worms are self-replicating malware that spread between programs, apps and devices without the need for human interaction."
Trojan horses are,"Trojan horses are programs that pretend to be helpful or hide themselves within desired or legitimate software to ""trick users into installing them."" Once installed, a RAT (Remote Access Trojan) can create a secret backdoor on the affected device to cause damage."
Spyware is a,Spyware is a type of malware that secretly gathers information from an infected computer and transmits the sensitive information back to the attacker
One of the,"One of the most common forms of spyware is keyloggers, which record all of a user's keyboard inputs/keystrokes, to ""allow hackers to harvest usernames, passwords, bank account and credit card numbers."""
"Scareware, as the","Scareware, as the name suggests, is a form of malware that uses social engineering (manipulation) to scare, shock, trigger anxiety, or suggest the perception of a threat in order to manipulate users into buying or installing unwanted software"
These attacks often,"These attacks often begin with a ""sudden pop-up with an urgent message, usually warning the user that they've broken the law or their device has a virus."""
Ransomware is when,"Ransomware is when malware installs itself onto a victim's machine, encrypts their files, and then turns around and demands a ransom (usually in Bitcoin) to return that data to the user."
Man-in-the-middle attacks (MITM),"Man-in-the-middle attacks (MITM) involve a malicious attacker trying to intercept, surveil or modify communications between two parties by spoofing one or both party's identities and injecting themselves in-between"
IP address spoofing,IP address spoofing is where the attacker hijacks routing protocols to reroute the targets traffic to a vulnerable network node for traffic interception or injection.
Message spoofing (via,"Message spoofing (via email, SMS or OTT messaging) is where the attacker spoofs the identity or carrier service while the target is using messaging protocols like email, SMS or OTT (IP-based) messaging apps"
The attacker can,"The attacker can then monitor conversations, launch social attacks or trigger zero-day-vulnerabilities to allow for further attacks."
WiFi SSID spoofing,WiFi SSID spoofing is where the attacker simulates a WIFI base station SSID to capture and modify internet traffic and transactions
The attacker can,The attacker can also use local network addressing and reduced network defenses to penetrate the target's firewall by breaching known vulnerabilities
Sometimes known as,Sometimes known as a Pineapple attack thanks to a popular device
DNS spoofing is,"DNS spoofing is where attackers hijack domain name assignments to redirect traffic to systems under the attackers control, in order to surveil traffic or launch other attacks."
"SSL hijacking, typically","SSL hijacking, typically coupled with another media-level MITM attack, is where the attacker spoofs the SSL authentication and encryption protocol by way of Certificate Authority injection in order to decrypt, surveil and modify traffic"
"=== Multi-vector, polymorphic","=== Multi-vector, polymorphic attacks ==="
"Surfacing in 2017,","Surfacing in 2017, a new class of multi-vector, polymorphic cyber threats combine several types of attacks and change form to avoid cyber security controls as they spread."
"Multi-vector polymorphic attacks,","Multi-vector polymorphic attacks, as the name describes, are both multi-vectored and polymorphic"
"Firstly, they are","Firstly, they are a singular attack that involves multiple methods of attack"
"In this sense,","In this sense, they are ""multi-vectored"" (i.e"
the attack can,"the attack can use multiple means of propagation such as via the Web, email and applications)"
"However, they are","However, they are also multi-staged, meaning that ""they can infiltrate networks and move laterally inside the network."" The attacks can be polymorphic, meaning that the cyberattacks used such as viruses, worms or trojans ""constantly change (""morph"") making it nearly impossible to detect them using signature-based defences."""
Phishing is the,"Phishing is the attempt to acquire sensitive information such as usernames, passwords, and credit card details directly from users by deceiving the users"
Phishing is typically,"Phishing is typically carried out by email spoofing, instant messaging, text message, or on a phone call"
They often direct,They often direct users to enter details at a fake website whose look and feel are almost identical to the legitimate one
The fake website,"The fake website often asks for personal information, such as login details and passwords"
This information can,This information can then be used to gain access to the individual's real account on the real website.
Preying on a,"Preying on a victim's trust, phishing can be classified as a form of social engineering"
Attackers can use,Attackers can use creative ways to gain access to real accounts
A common scam,"A common scam is for attackers to send fake electronic invoices to individuals showing that they recently purchased music, apps, or others, and instructing them to click on a link if the purchases were not authorized"
A more strategic,A more strategic type of phishing is spear-phishing which leverages personal or organization-specific details to make the attacker appear like a trusted source
Spear-phishing attacks target,"Spear-phishing attacks target specific individuals, rather than the broad net cast by phishing attempts."
Privilege escalation describes,"Privilege escalation describes a situation where an attacker with some level of restricted access is able to, without authorization, elevate their privileges or access level"
"For example, a","For example, a standard computer user may be able to exploit a vulnerability in the system to gain access to restricted data; or even become root and have full unrestricted access to a system"
The severity of,The severity of attacks can range from attacks simply sending an unsolicited email to a ransomware attack on large amounts of data
Privilege escalation usually,"Privilege escalation usually starts with social engineering techniques, often phishing."
Privilege escalation can,"Privilege escalation can be separated into two strategies, horizontal and vertical privilege escalation:"
Horizontal escalation (or,Horizontal escalation (or account takeover) is where an attacker gains access to a normal user account that has relatively low-level privileges
This may be,This may be through stealing the user's username and password
Once they have,"Once they have access, they have gained a foothold, and using this foothold the attacker then may move around the network of users at this same lower level, gaining access to information of this similar privilege."
"Vertical escalation, however,","Vertical escalation, however, targets people higher up in a company and often with more administrative power, such as an employee in IT with a higher privilege"
Using this privileged,Using this privileged account will then enable the attacker to invade other accounts.
Any computational system,Any computational system affects its environment in some form
This effect it,"This effect it has on its environment can range from electromagnetic radiation, to residual effect on RAM cells which as a consequence make a Cold boot attack possible, to hardware implementation faults that allow for access or guessing of other values that normally should be inaccessible"
In Side-channel attack,"In Side-channel attack scenarios, the attacker would gather such information about a system or network to guess its internal state and as a result access the information which is assumed by the victim to be secure"
The target information,The target information in a side channel can be challenging to detect due to its low amplitude when combined with other signals
"Social engineering, in","Social engineering, in the context of computer security, aims to convince a user to disclose secrets such as passwords, card numbers, etc"
or grant physical,"or grant physical access by, for example, impersonating a senior executive, bank, a contractor, or a customer"
This generally involves,"This generally involves exploiting people's trust, and relying on their cognitive biases"
A common scam,"A common scam involves emails sent to accounting and finance department personnel, impersonating their CEO and urgently requesting some action"
One of the,One of the main techniques of social engineering are phishing attacks.
"In early 2016,","In early 2016, the FBI reported that such business email compromise (BEC) scams had cost US businesses more than $2 billion in about two years."
"In May 2016,","In May 2016, the Milwaukee Bucks NBA team was the victim of this type of cyber scam with a perpetrator impersonating the team's president Peter Feigin, resulting in the handover of all the team's employees' 2015 W-2 tax forms."
Spoofing is an,"Spoofing is an act of pretending to be a valid entity through the falsification of data (such as an IP address or username), in order to gain access to information or resources that one is otherwise unauthorized to obtain"
There are several,"There are several types of spoofing, including:"
Email spoofing is,"Email spoofing is where an attacker forges the sending (From, or source) address of an email."
"IP address spoofing,","IP address spoofing, where an attacker alters the source IP address in a network packet to hide their identity or impersonate another computing system."
"MAC spoofing, where","MAC spoofing, where an attacker modifies the Media Access Control (MAC) address of their network interface controller to obscure their identity, or to pose as another."
"Biometric spoofing, where","Biometric spoofing, where an attacker produces a fake biometric sample to pose as another user."
Address Resolution Protocol,"Address Resolution Protocol (ARP) spoofing, where an attacker sends spoofed address resolution protocol onto a local area network to associate their Media Access Control address with a different host's IP address"
This causes data,This causes data to be sent to the attacker rather than the intended host.
"In 2018, the","In 2018, the cyber security firm Trellix published research on the life-threatening risk of spoofing in the healthcare industry."
Tampering describes a,Tampering describes a malicious modification or alteration of data
It is an,"It is an intentional but unauthorized act resulting in the modification of a system, components of systems, its intended behavior, or data"
So-called Evil Maid,So-called Evil Maid attacks and security services planting of surveillance capability into routers are examples.
HTML smuggling allows,HTML smuggling allows an attacker to smuggle a malicious code inside a particular HTML or web page
HTML files can,"HTML files can carry payloads concealed as benign, inert data in order to defeat content filters"
These payloads can,These payloads can be reconstructed on the other side of the filter.
When a target,"When a target user opens the HTML, the malicious code is activated; the web browser then decodes the script, which then unleashes the malware onto the target's device."
Employee behavior can,Employee behavior can have a big impact on information security in organizations
Cultural concepts can,Cultural concepts can help different segments of the organization work effectively or work against effectiveness toward information security within an organization
Information security culture,"Information security culture is the ""...totality of patterns of behavior in an organization that contributes to the protection of information of all kinds."""
Andersson and Reimers,Andersson and Reimers (2014) found that employees often do not see themselves as part of their organization's information security effort and often take actions that impede organizational changes
"Indeed, the Verizon","Indeed, the Verizon Data Breach Investigations Report 2020, which examined 3,950 security breaches, discovered 30% of cyber security incidents involved internal actors within a company"
Research shows information,Research shows information security culture needs to be improved continuously
"In ""Information Security","In ""Information Security Culture from Analysis to Change"", authors commented, ""It's a never-ending process, a cycle of evaluation and change or maintenance."" To manage the information security culture, five steps should be taken: pre-evaluation, strategic planning, operative planning, implementation, and post-evaluation."
Pre-evaluation: To identify,Pre-evaluation: To identify the awareness of information security within employees and to analyze the current security policies.
Strategic planning: To,"Strategic planning: To come up with a better awareness program, clear targets need to be set"
Assembling a team,Assembling a team of skilled professionals is helpful to achieve it.
Operative planning: A,"Operative planning: A good security culture can be established based on internal communication, management buy-in, security awareness and a training program."
Implementation: Four stages,Implementation: Four stages should be used to implement the information security culture
Communication with organizational,Communication with organizational members
Post-evaluation: To assess,"Post-evaluation: To assess the success of the planning and implementation, and to identify unresolved areas of concern."
== Computer protection,== Computer protection (countermeasures) ==
"In computer security,","In computer security, a countermeasure is an action, device, procedure or technique that reduces a threat, a vulnerability, or an attack by eliminating or preventing it, by minimizing the harm it can cause, or by discovering and reporting it so that corrective action can be taken."
Some common countermeasures,Some common countermeasures are listed in the following sections:
"Security by design,","Security by design, or alternately secure by design, means that the software has been designed from the ground up to be secure"
"In this case,","In this case, security is considered a main feature."
The UK government's,The UK government's National Cyber Security Centre separates secure cyber design principles into five sections:
Before a secure,"Before a secure system is created or updated, companies should ensure they understand the fundamentals and the context around the system they are trying to create and identify any weaknesses in the system."
Companies should design,Companies should design and centre their security around techniques and defences which make attacking their data or systems inherently more challenging for attackers.
Companies should ensure,Companies should ensure that their core services that rely on technology are protected so that the systems are essentially never down.
Although systems can,"Although systems can be created which are safe against a multitude of attacks, that does not mean that attacks will not be attempted"
"Despite one's security,","Despite one's security, all companies' systems should aim to be able to detect and spot attacks as soon as they occur to ensure the most effective response to them."
Companies should create,Companies should create secure systems designed so that any attack that is successful has minimal severity.
These design principles,These design principles of security by design can include some of the following techniques:
The principle of,"The principle of least privilege, where each part of the system has only the privileges that are needed for its function"
"That way, even","That way, even if an attacker gains access to that part, they only have limited access to the whole system."
Automated theorem proving,Automated theorem proving to prove the correctness of crucial software subsystems.
Code reviews and,"Code reviews and unit testing, approaches to make modules more secure where formal correctness proofs are not possible."
"Defense in depth,","Defense in depth, where the design is such that more than one subsystem needs to be violated to compromise the integrity of the system and the information it holds."
"Default secure settings,","Default secure settings, and design to fail secure rather than fail insecure (see fail-safe for the equivalent in safety engineering)"
"Ideally, a secure","Ideally, a secure system should require a deliberate, conscious, knowledgeable and free decision on the part of legitimate authorities in order to make it insecure."
Audit trails track,"Audit trails track system activity so that when a security breach occurs, the mechanism and extent of the breach can be determined"
Storing audit trails,"Storing audit trails remotely, where they can only be appended to, can keep intruders from covering their tracks."
Full disclosure of,"Full disclosure of all vulnerabilities, to ensure that the window of vulnerability is kept as short as possible when bugs are discovered."
Security architecture can,"Security architecture can be defined as the ""practice of designing computer systems to achieve security goals."" These goals have overlap with the principles of ""security by design"" explored above, including to ""make initial compromise of the system difficult,"" and to ""limit the impact of any compromise."" In practice, the role of a security architect would be to ensure the structure of a system reinforces the security of the system, and that new changes are safe and meet the security requirements of the organization."
"Similarly, Techopedia defines","Similarly, Techopedia defines security architecture as ""a unified security design that addresses the necessities and potential risks involved in a certain scenario or environment"
It also specifies,It also specifies when and where to apply security controls
The design process,"The design process is generally reproducible."" The key attributes of security architecture are:"
