Question,Answer
Artificial intelligence (AI),"Artificial intelligence (AI) is the capability of computational systems to perform tasks typically associated with human intelligence, such as learning, reasoning, problem-solving, perception, and decision-making"
It is a,It is a field of research in computer science that develops and studies methods and software that enable machines to perceive their environment and use learning and intelligence to take actions that maximize their chances of achieving defined goals.
High-profile applications of,"High-profile applications of AI include advanced web search engines (e.g., Google Search); recommendation systems (used by YouTube, Amazon, and Netflix); virtual assistants (e.g., Google Assistant, Siri, and Alexa); autonomous vehicles (e.g., Waymo); generative and creative tools (e.g., language models and AI art); and superhuman play and analysis in strategy games (e.g., chess and Go)"
"However, many AI","However, many AI applications are not perceived as AI: ""A lot of cutting edge AI has filtered into general applications, often without being called AI because once something becomes useful enough and common enough it's not labeled AI anymore."""
Various subfields of,Various subfields of AI research are centered around particular goals and the use of particular tools
The traditional goals,"The traditional goals of AI research include learning, reasoning, knowledge representation, planning, natural language processing, perception, and support for robotics"
To reach these,"To reach these goals, AI researchers have adapted and integrated a wide range of techniques, including search and mathematical optimization, formal logic, artificial neural networks, and methods based on statistics, operations research, and economics"
AI also draws,"AI also draws upon psychology, linguistics, philosophy, neuroscience, and other fields"
"Some companies, such","Some companies, such as OpenAI, Google DeepMind and Meta, aim to create artificial general intelligence (AGI) – AI that can complete virtually any cognitive task at least as well as a human."
Artificial intelligence was,"Artificial intelligence was founded as an academic discipline in 1956, and the field went through multiple cycles of optimism throughout its history, followed by periods of disappointment and loss of funding, known as AI winters"
Funding and interest,"Funding and interest vastly increased after 2012 when graphics processing units started being used to accelerate neural networks, and deep learning outperformed previous AI techniques"
This growth accelerated,This growth accelerated further after 2017 with the transformer architecture
"In the 2020s,","In the 2020s, an ongoing period of rapid progress in advanced generative AI became known as the AI boom"
Generative AI's ability,Generative AI's ability to create and modify content has led to several unintended consequences and harms
Ethical concerns have,"Ethical concerns have been raised about AI's long-term effects and potential existential risks, prompting discussions about regulatory policies to ensure the safety and benefits of the technology."
The general problem,The general problem of simulating (or creating) intelligence has been broken into subproblems
These consist of,These consist of particular traits or capabilities that researchers expect an intelligent system to display
The traits described,The traits described below have received the most attention and cover the scope of AI research.
Early researchers developed,Early researchers developed algorithms that imitated step-by-step reasoning that humans use when they solve puzzles or make logical deductions
By the late,"By the late 1980s and 1990s, methods were developed for dealing with uncertain or incomplete information, employing concepts from probability and economics."
Many of these,"Many of these algorithms are insufficient for solving large reasoning problems because they experience a ""combinatorial explosion"": They become exponentially slower as the problems grow"
Even humans rarely,Even humans rarely use the step-by-step deduction that early AI research could model
They solve most,"They solve most of their problems using fast, intuitive judgments"
Accurate and efficient,Accurate and efficient reasoning is an unsolved problem.
Knowledge representation and,Knowledge representation and knowledge engineering allow AI programs to answer questions intelligently and make deductions about real-world facts
Formal knowledge representations,"Formal knowledge representations are used in content-based indexing and retrieval, scene interpretation, clinical decision support, knowledge discovery (mining ""interesting"" and actionable inferences from large databases), and other areas."
A knowledge base,A knowledge base is a body of knowledge represented in a form that can be used by a program
An ontology is,"An ontology is the set of objects, relations, concepts, and properties used by a particular domain of knowledge"
Knowledge bases need,"Knowledge bases need to represent things such as objects, properties, categories, and relations between objects; situations, events, states, and time; causes and effects; knowledge about knowledge (what we know about what other people know); default reasoning (things that humans assume are true until they are told differently and will remain true even when other facts are changing); and many other aspects and domains of knowledge."
Among the most,"Among the most difficult problems in knowledge representation are the breadth of commonsense knowledge (the set of atomic facts that the average person knows is enormous); and the sub-symbolic form of most commonsense knowledge (much of what people know is not represented as ""facts"" or ""statements"" that they could express verbally)"
There is also,"There is also the difficulty of knowledge acquisition, the problem of obtaining knowledge for AI applications."
"An ""agent"" is","An ""agent"" is anything that perceives and takes actions in the world"
A rational agent,A rational agent has goals or preferences and takes actions to make them happen
"In automated planning,","In automated planning, the agent has a specific goal"
"In automated decision-making,","In automated decision-making, the agent has preferences—there are some situations it would prefer to be in, and some situations it is trying to avoid"
The decision-making agent,"The decision-making agent assigns a number to each situation (called the ""utility"") that measures how much the agent prefers it"
For each possible,"For each possible action, it can calculate the ""expected utility"": the utility of all possible outcomes of the action, weighted by the probability that the outcome will occur"
It can then,It can then choose the action with the maximum expected utility.
"In classical planning,","In classical planning, the agent knows exactly what the effect of any action will be"
In most real-world,"In most real-world problems, however, the agent may not be certain about the situation they are in (it is ""unknown"" or ""unobservable"") and it may not know for certain what will happen after each possible action (it is not ""deterministic"")"
It must choose,It must choose an action by making a probabilistic guess and then reassess the situation to see if the action worked.
"In some problems,","In some problems, the agent's preferences may be uncertain, especially if there are other agents or humans involved"
These can be,"These can be learned (e.g., with inverse reinforcement learning), or the agent can seek information to improve its preferences"
Information value theory,Information value theory can be used to weigh the value of exploratory or experimental actions
The space of,"The space of possible future actions and situations is typically intractably large, so the agents must take actions and evaluate situations while being uncertain of what the outcome will be."
A Markov decision,A Markov decision process has a transition model that describes the probability that a particular action will change the state in a particular way and a reward function that supplies the utility of each state and the cost of each action
A policy associates,A policy associates a decision with each possible state
The policy could,"The policy could be calculated (e.g., by iteration), be heuristic, or it can be learned."
Game theory describes,Game theory describes the rational behavior of multiple interacting agents and is used in AI programs that make decisions that involve other agents.
Machine learning is,Machine learning is the study of programs that can improve their performance on a given task automatically
It has been,It has been a part of AI from the beginning.
There are several,There are several kinds of machine learning
Unsupervised learning analyzes,Unsupervised learning analyzes a stream of data and finds patterns and makes predictions without any other guidance
Supervised learning requires,"Supervised learning requires labeling the training data with the expected answers, and comes in two main varieties: classification (where the program must learn to predict what category the input belongs in) and regression (where the program must deduce a numeric function based on numeric input)."
"In reinforcement learning,","In reinforcement learning, the agent is rewarded for good responses and punished for bad ones"
The agent learns,"The agent learns to choose responses that are classified as ""good"""
Transfer learning is,Transfer learning is when the knowledge gained from one problem is applied to a new problem
Deep learning is,Deep learning is a type of machine learning that runs inputs through biologically inspired artificial neural networks for all of these types of learning.
Computational learning theory,"Computational learning theory can assess learners by computational complexity, by sample complexity (how much data is required), or by other notions of optimization."
Natural language processing,"Natural language processing (NLP) allows programs to read, write and communicate in human languages"
Specific problems include,"Specific problems include speech recognition, speech synthesis, machine translation, information extraction, information retrieval and question answering."
"Early work, based","Early work, based on Noam Chomsky's generative grammar and semantic networks, had difficulty with word-sense disambiguation unless restricted to small domains called ""micro-worlds"" (due to the common sense knowledge problem)"
Margaret Masterman believed,"Margaret Masterman believed that it was meaning and not grammar that was the key to understanding languages, and that thesauri and not dictionaries should be the basis of computational language structure."
Modern deep learning,"Modern deep learning techniques for NLP include word embedding (representing words, typically as vectors encoding their meaning), transformers (a deep learning architecture using an attention mechanism), and others"
"In 2019, generative","In 2019, generative pre-trained transformer (or ""GPT"") language models began to generate coherent text, and by 2023, these models were able to get human-level scores on the bar exam, SAT test, GRE test, and many other real-world applications."
Machine perception is,"Machine perception is the ability to use input from sensors (such as cameras, microphones, wireless signals, active lidar, sonar, radar, and tactile sensors) to deduce aspects of the world"
Computer vision is,Computer vision is the ability to analyze visual input.
The field includes,"The field includes speech recognition, image classification, facial recognition, object recognition, object tracking, and robotic perception."
Affective computing is,"Affective computing is a field that comprises systems that recognize, interpret, process, or simulate human feeling, emotion, and mood"
"For example, some","For example, some virtual assistants are programmed to speak conversationally or even to banter humorously; it makes them appear more sensitive to the emotional dynamics of human interaction, or to otherwise facilitate human–computer interaction."
"However, this tends","However, this tends to give naïve users an unrealistic conception of the intelligence of existing computer agents"
Moderate successes related,"Moderate successes related to affective computing include textual sentiment analysis and, more recently, multimodal sentiment analysis, wherein AI classifies the effects displayed by a videotaped subject."
A machine with,A machine with artificial general intelligence would be able to solve a wide variety of problems with breadth and versatility similar to human intelligence.
AI research uses,AI research uses a wide variety of techniques to accomplish the goals above.
AI can solve,AI can solve many problems by intelligently searching through many possible solutions
There are two,There are two very different kinds of search used in AI: state space search and local search.
State space search,State space search searches through a tree of possible states to try to find a goal state
"For example, planning","For example, planning algorithms search through trees of goals and subgoals, attempting to find a path to a target goal, a process called means-ends analysis."
Simple exhaustive searches,Simple exhaustive searches are rarely sufficient for most real-world problems: the search space (the number of places to search) quickly grows to astronomical numbers
The result is,The result is a search that is too slow or never completes
"""Heuristics"" or ""rules","""Heuristics"" or ""rules of thumb"" can help prioritize choices that are more likely to reach a goal."
Adversarial search is,"Adversarial search is used for game-playing programs, such as chess or Go"
It searches through,"It searches through a tree of possible moves and countermoves, looking for a winning position."
Local search uses,Local search uses mathematical optimization to find a solution to a problem
It begins with,It begins with some form of guess and refines it incrementally.
Gradient descent is,Gradient descent is a type of local search that optimizes a set of numerical parameters by incrementally adjusting them to minimize a loss function
Variants of gradient,"Variants of gradient descent are commonly used to train neural networks, through the backpropagation algorithm."
Another type of,"Another type of local search is evolutionary computation, which aims to iteratively improve a set of candidate solutions by ""mutating"" and ""recombining"" them, selecting only the fittest to survive each generation."
Distributed search processes,Distributed search processes can coordinate via swarm intelligence algorithms
Two popular swarm,Two popular swarm algorithms used in search are particle swarm optimization (inspired by bird flocking) and ant colony optimization (inspired by ant trails).
Formal logic is,Formal logic is used for reasoning and knowledge representation.
Formal logic comes,"Formal logic comes in two main forms: propositional logic (which operates on statements that are true or false and uses logical connectives such as ""and"", ""or"", ""not"" and ""implies"") and predicate logic (which also operates on objects, predicates and relations and uses quantifiers such as ""Every X is a Y"" and ""There are some Xs that are Ys"")."
Deductive reasoning in,Deductive reasoning in logic is the process of proving a new statement (conclusion) from other statements that are given and assumed to be true (the premises)
Proofs can be,"Proofs can be structured as proof trees, in which nodes are labelled by sentences, and children nodes are connected to parent nodes by inference rules."
Given a problem,"Given a problem and a set of premises, problem-solving reduces to searching for a proof tree whose root node is labelled by a solution of the problem and whose leaf nodes are labelled by premises or axioms"
In the case,"In the case of Horn clauses, problem-solving search can be performed by reasoning forwards from the premises or backwards from the problem"
In the more,"In the more general case of the clausal form of first-order logic, resolution is a single, axiom-free rule of inference, in which a problem is solved by proving a contradiction from premises that include the negation of the problem to be solved."
Inference in both,"Inference in both Horn clause logic and first-order logic is undecidable, and therefore intractable"
"However, backward reasoning","However, backward reasoning with Horn clauses, which underpins computation in the logic programming language Prolog, is Turing complete"
"Moreover, its efficiency","Moreover, its efficiency is competitive with computation in other symbolic programming languages."
Fuzzy logic assigns,"Fuzzy logic assigns a ""degree of truth"" between 0 and 1"
It can therefore,It can therefore handle propositions that are vague and partially true.
"Non-monotonic logics, including","Non-monotonic logics, including logic programming with negation as failure, are designed to handle default reasoning"
Other specialized versions,Other specialized versions of logic have been developed to describe many complex domains.
=== Probabilistic methods,=== Probabilistic methods for uncertain reasoning ===
Many problems in,"Many problems in AI (including reasoning, planning, learning, perception, and robotics) require the agent to operate with incomplete or uncertain information"
AI researchers have,AI researchers have devised a number of tools to solve these problems using methods from probability theory and economics
Precise mathematical tools,"Precise mathematical tools have been developed that analyze how an agent can make choices and plan, using decision theory, decision analysis, and information value theory"
These tools include,"These tools include models such as Markov decision processes, dynamic decision networks, game theory and mechanism design."
Bayesian networks are,"Bayesian networks are a tool that can be used for reasoning (using the Bayesian inference algorithm), learning (using the expectation–maximization algorithm), planning (using decision networks) and perception (using dynamic Bayesian networks)."
Probabilistic algorithms can,"Probabilistic algorithms can also be used for filtering, prediction, smoothing, and finding explanations for streams of data, thus helping perception systems analyze processes that occur over time (e.g., hidden Markov models or Kalman filters)."
=== Classifiers and,=== Classifiers and statistical learning methods ===
The simplest AI,"The simplest AI applications can be divided into two types: classifiers (e.g., ""if shiny then diamond""), on one hand, and controllers (e.g., ""if diamond then pick up""), on the other hand"
Classifiers are functions,Classifiers are functions that use pattern matching to determine the closest match
They can be,They can be fine-tuned based on chosen examples using supervised learning
Each pattern (also,"Each pattern (also called an ""observation"") is labeled with a certain predefined class"
All the observations,All the observations combined with their class labels are known as a data set
When a new,"When a new observation is received, that observation is classified based on previous experience."
There are many,There are many kinds of classifiers in use
The decision tree,The decision tree is the simplest and most widely used symbolic machine learning algorithm
K-nearest neighbor algorithm,"K-nearest neighbor algorithm was the most widely used analogical AI until the mid-1990s, and Kernel methods such as the support vector machine (SVM) displaced k-nearest neighbor in the 1990s."
The naive Bayes,"The naive Bayes classifier is reportedly the ""most widely used learner"" at Google, due in part to its scalability."
Neural networks are,Neural networks are also used as classifiers.
An artificial neural,"An artificial neural network is based on a collection of nodes also known as artificial neurons, which loosely model the neurons in a biological brain"
It is trained,"It is trained to recognise patterns; once trained, it can recognise those patterns in fresh data"
There is an,"There is an input, at least one hidden layer of nodes and an output"
Each node applies,"Each node applies a function and once the weight crosses its specified threshold, the data is transmitted to the next layer"
A network is,A network is typically called a deep neural network if it has at least 2 hidden layers.
Learning algorithms for,Learning algorithms for neural networks use local search to choose the weights that will get the right output for each input during training
The most common,The most common training technique is the backpropagation algorithm
Neural networks learn,Neural networks learn to model complex relationships between inputs and outputs and find patterns in data
"In theory, a","In theory, a neural network can learn any function."
In feedforward neural,In feedforward neural networks the signal passes in only one direction
The term perceptron,The term perceptron typically refers to a single-layer neural network
"In contrast, deep","In contrast, deep learning uses many layers"
Recurrent neural networks,"Recurrent neural networks (RNNs) feed the output signal back into the input, which allows short-term memories of previous input events"
Long short-term memory,Long short-term memory networks (LSTMs) are recurrent neural networks that better preserve longterm dependencies and are less sensitive to the vanishing gradient problem
Convolutional neural networks,Convolutional neural networks (CNNs) use layers of kernels to more efficiently process local patterns
This local processing,"This local processing is especially important in image processing, where the early CNN layers typically identify simple local patterns such as edges and curves, with subsequent layers detecting more complex patterns like textures, and eventually whole objects."
Deep learning uses,Deep learning uses several layers of neurons between the network's inputs and outputs
The multiple layers,The multiple layers can progressively extract higher-level features from the raw input
"For example, in","For example, in image processing, lower layers may identify edges, while higher layers may identify the concepts relevant to a human such as digits, letters, or faces."
Deep learning has,"Deep learning has profoundly improved the performance of programs in many important subfields of artificial intelligence, including computer vision, speech recognition, natural language processing, image classification, and others"
The reason that,The reason that deep learning performs so well in so many applications is not known as of 2021
The sudden success,"The sudden success of deep learning in 2012–2015 did not occur because of some new discovery or theoretical breakthrough (deep neural networks and backpropagation had been described by many people, as far back as the 1950s) but because of two factors: the incredible increase in computer power (including the hundred-fold increase in speed by switching to GPUs) and the availability of vast amounts of training data, especially the giant curated datasets used for benchmark testing, such as ImageNet."
Generative pre-trained transformers,Generative pre-trained transformers (GPT) are large language models (LLMs) that generate text based on the semantic relationships between words in sentences
Text-based GPT models,Text-based GPT models are pre-trained on a large corpus of text that can be from the Internet
The pretraining consists,"The pretraining consists of predicting the next token (a token being usually a word, subword, or punctuation)"
"Throughout this pretraining,","Throughout this pretraining, GPT models accumulate knowledge about the world and can then generate human-like text by repeatedly predicting the next token"
"Typically, a subsequent","Typically, a subsequent training phase makes the model more truthful, useful, and harmless, usually with a technique called reinforcement learning from human feedback (RLHF)"
Current GPT models,"Current GPT models are prone to generating falsehoods called ""hallucinations"""
These can be,"These can be reduced with RLHF and quality data, but the problem has been getting worse for reasoning systems"
Such systems are,"Such systems are used in chatbots, which allow people to ask a question or request a task in simple text."
Current models and,"Current models and services include ChatGPT, Claude, Gemini, Copilot, and Meta AI"
Multimodal GPT models,"Multimodal GPT models can process different types of data (modalities) such as images, videos, sound, and text."
In the late,"In the late 2010s, graphics processing units (GPUs) that were increasingly designed with AI-specific enhancements and used with specialized TensorFlow software had replaced previously used central processing unit (CPUs) as the dominant means for large-scale (commercial and academic) machine learning models' training"
Specialized programming languages,"Specialized programming languages such as Prolog were used in early AI research, but general-purpose programming languages like Python have become predominant."
The transistor density,"The transistor density in integrated circuits has been observed to roughly double every 18 months—a trend known as Moore's law, named after the Intel co-founder Gordon Moore, who first identified it"
Improvements in GPUs,"Improvements in GPUs have been even faster, a trend sometimes called Huang's law, named after Nvidia co-founder and CEO Jensen Huang."
AI and machine,"AI and machine learning technology is used in most of the essential applications of the 2020s, including:"
